{
  "$schema": "https://json-schema.org/draft/2020-12/schema",
  "title": "orchestrate plugin config",
  "description": "Tuning knobs for the orchestrate router. The active harness resolves its profile first; explicit role values then override it. Config is layered (deep-merged, first present wins per key).",
  "type": "object",
  "additionalProperties": false,
  "properties": {
    "$schema": { "type": "string" },
    "autonomy": {
      "description": "How autonomous the orchestrator is once it has classified the task and built a plan. propose = announce the workflow + plan and wait for OK (default); auto = run immediately; threshold = auto only when under the threshold limits, otherwise propose.",
      "enum": ["propose", "auto", "threshold"],
      "default": "propose"
    },
    "harness": {
      "description": "auto selects from the running agent runtime's delegation capability; claude and codex force one profile. Use a forced profile only for a known harness-specific installation.",
      "enum": ["auto", "claude", "codex"],
      "default": "auto"
    },
    "threshold": {
      "description": "Limits used when autonomy=threshold. At or below these, fan out automatically; above either, propose first.",
      "type": "object",
      "additionalProperties": false,
      "properties": {
        "maxParallelAuto": { "type": "integer", "minimum": 1, "default": 3 },
        "maxFilesAuto": { "type": "integer", "minimum": 1, "default": 5 }
      }
    },
    "roles": {
      "description": "Explicit model overrides for the three roles. auto takes the role from the active harness profile. Use only model IDs or aliases supported by the running harness.",
      "type": "object",
      "additionalProperties": false,
      "properties": {
        "orchestrator": { "type": "string", "default": "auto" },
        "builder": { "type": "string", "default": "auto" },
        "scout": { "type": "string", "default": "auto" }
      }
    },
    "harnessProfiles": {
      "description": "Per-harness fallback models. These are defaults, not a capability registry: when a runtime exposes a different supported-model list, update this profile or leave roles as auto to inherit the runtime default.",
      "type": "object",
      "additionalProperties": false,
      "properties": {
        "claude": { "$ref": "#/$defs/harnessProfile" },
        "codex": { "$ref": "#/$defs/harnessProfile" }
      }
    },
    "workflows": {
      "description": "Which pre-curated workflows the router may select, and per-workflow fan-out caps. A disabled workflow is never routed to; the router falls back to the closest enabled workflow or asks.",
      "type": "object",
      "additionalProperties": false,
      "properties": {
        "research":  { "$ref": "#/$defs/workflow" },
        "design":    { "$ref": "#/$defs/workflow" },
        "implement": { "$ref": "#/$defs/workflow" },
        "debug":     { "$ref": "#/$defs/workflow" },
        "review":    { "$ref": "#/$defs/workflow" },
        "optimize":  { "$ref": "#/$defs/workflow" }
      }
    },
    "worktrees": {
      "description": "Git worktree isolation for writing nodes of the work graph. Worktrees are created, merged, and removed only through the skill's bundled scripts/worktree.sh.",
      "type": "object",
      "additionalProperties": false,
      "properties": {
        "mode": {
          "description": "auto = a worktree per writing node whenever two or more run concurrently; always = a worktree for every writing node; off = builders share the main checkout.",
          "enum": ["auto", "always", "off"],
          "default": "auto"
        },
        "cleanup": {
          "description": "on-success = remove merged worktrees and keep any with unmerged or uncommitted work for inspection; always = force-remove every worktree of the run at the end, discarding unmerged work.",
          "enum": ["on-success", "always"],
          "default": "on-success"
        },
        "link": {
          "description": "Gitignored paths (relative to the repo root) symlinked from the main checkout into each new worktree so nodes can build and test, e.g. [\"node_modules\", \".venv\", \".env\"]. Shared, not copied: nodes must not install packages through them.",
          "type": "array",
          "items": { "type": "string", "pattern": "^[^/].*" },
          "default": []
        },
        "setup": {
          "description": "Optional command run inside each new worktree before its builder starts (e.g. \"npm ci\"). Runs as an ordinary command under normal permissions, never through the pre-approved worktree script.",
          "type": "string"
        }
      }
    },
    "escalation": {
      "description": "Cascade behavior. When a scout (Haiku) returns thin or low-confidence output on a leg, re-run that one leg at the builder tier before giving up.",
      "type": "object",
      "additionalProperties": false,
      "properties": {
        "scoutToBuilder": { "type": "boolean", "default": true }
      }
    },
    "doctrine": {
      "description": "How forcefully the SessionStart hook injects the delegation doctrine. off = no injection; standard = inject as guidance; strict = inject as a hard rule.",
      "enum": ["off", "standard", "strict"],
      "default": "standard"
    },
    "alwaysPassModelExplicitly": {
      "description": "Instruct the orchestrator to pass the model parameter explicitly on every Agent call, working around the frontmatter model bug (anthropics/claude-code#44385).",
      "type": "boolean",
      "default": true
    }
  },
  "$defs": {
    "workflow": {
      "type": "object",
      "additionalProperties": false,
      "properties": {
        "enabled": { "type": "boolean", "default": true },
        "maxParallel": {
          "description": "Cap on parallel fan-out agents for this workflow. Guards against the over-fan-out failure mode (Anthropic multi-agent research: fan-out is ~15x the tokens of a single pass).",
          "type": "integer",
          "minimum": 1,
          "default": 4
        }
      }
    },
    "harnessProfile": {
      "type": "object",
      "additionalProperties": false,
      "properties": {
        "roles": {
          "type": "object",
          "additionalProperties": false,
          "properties": {
            "orchestrator": { "type": "string" },
            "builder": { "type": "string" },
            "scout": { "type": "string" }
          }
        }
      }
    }
  }
}
